{"receiptId":"review-human","provenance":"human-confirmed","actorLabel":"Leo","taskId":"task","taskRevision":1,"leaseGeneration":1,"specHash":"aaaaaaaaaaaaaaaaaaaaaaaaaaaaaaaaaaaaaaaaaaaaaaaaaaaaaaaaaaaaaaaa","taskHash":"bbbbbbbbbbbbbbbbbbbbbbbbbbbbbbbbbbbbbbbbbbbbbbbbbbbbbbbbbbbbbbbb","treeHash":"cccccccccccccccccccccccccccccccccccccccccccccccccccccccccccccccc","findingsHash":"dddddddddddddddddddddddddddddddddddddddddddddddddddddddddddddddd","verdict":"pass","timestamp":"2099-01-01T00:00:00.000Z","expiresAt":"2099-01-02T00:00:00.000Z"}
